{
  "type": "object",
  "properties": {
    "correlationId": {
      "type": "string",
      "format": "uuid",
      "not": {
        "const": "00000000-0000-0000-0000-000000000000"
      }
    },
    "messageId": {
      "type": "string",
      "format": "uuid",
      "not": {
        "const": "00000000-0000-0000-0000-000000000000"
      }
    },
    "causationId": {
      "type": "string",
      "format": "uuid",
      "not": {
        "const": "00000000-0000-0000-0000-000000000000"
      }
    },
    "occurredOn": {
      "type": "string",
      "format": "date-time",
      "pattern": "(Z|\\\u002B00:00)$"
    },
    "operationVersion": {
      "type": "integer",
      "minimum": 1
    },
    "actorId": {
      "type": "string",
      "minLength": 1,
      "maxLength": 2000
    },
    "diagnosticId": {
      "type": "string",
      "format": "uuid",
      "not": {
        "const": "00000000-0000-0000-0000-000000000000"
      }
    },
    "budgetId": {
      "type": "string",
      "format": "uuid",
      "not": {
        "const": "00000000-0000-0000-0000-000000000000"
      }
    },
    "budgetRevision": {
      "type": "integer",
      "const": 1
    },
    "authorizationMessageId": {
      "type": "string",
      "format": "uuid",
      "not": {
        "const": "00000000-0000-0000-0000-000000000000"
      }
    }
  },
  "required": [
    "correlationId",
    "messageId",
    "causationId",
    "occurredOn",
    "operationVersion",
    "actorId",
    "diagnosticId",
    "budgetId",
    "budgetRevision",
    "authorizationMessageId"
  ],
  "$schema": "https://json-schema.org/draft/2020-12/schema",
  "title": "GearFlow.Contracts.Operation.V1.ExecutionAuthorized"
}
