{
  "correlationId": "10000000-0000-4000-8000-000000000001",
  "messageId": "60000000-0000-4000-8000-000000000008",
  "occurredOn": "2026-10-24T17:00:00Z",
  "causationId": "60000000-0000-4000-8000-000000000002",
  "operationVersion": 5,
  "actorId": "system:saga",
  "diagnosticId": "20000000-0000-4000-8000-000000000001",
  "budgetId": "30000000-0000-4000-8000-000000000001",
  "budgetRevision": 1,
  "authorizationMessageId": "60000000-0000-4000-8000-000000000002"
}
